age,45
gender,male
nationality,chilean
education,postgraduate
F851.jpg,O1709.jpg,1,the cat seems to want to surprise the other kitten
F649.jpg,O8.jpg,2,a pear that wants to lose weight by assimilating to a person
O1136.jpg,O8.jpg,2,a pear that wants to lose weight by assimilating to a person
O1383.jpg,O8.jpg,2,a pear that wants to lose weight by assimilating to a person
O611.jpg,M37.jpg,1,hunters don't know what awaits them
FM819.jpg,M319.jpg,1,the second image is not understood
M106.jpg,O1058.jpg,1,the first image is not understood
M222.jpg,O1748.jpg,2,excess alcohol and vomiting
F317.jpg,M637.jpg,1,the cat and its owner eat together
M524.jpg,O1709.jpg,2,the zebra looks like it's going to fall
FM921.jpg,O1058.jpg,1,the context is not understood.
O1080.jpg,O8.jpg,2,a fruit and the resemblance to a person trying to lose weight
FM137.jpg,O8.jpg,2,a fruit and the resemblance to a person trying to lose weight
O793.jpg,O1058.jpg,1,a dog and a child having a good time in the snow
O1280.jpg,M319.jpg,1,a man with the head of a fish, when he has to partially submerge himself in the water
O478.jpg,O1360.jpg,2,a dog trying to hide
O386.jpg,O1748.jpg,2,excess alcohol and vomiting
F889.jpg,O1748.jpg,1,the dog showing its tongue in an image as if it were a human taking a photo
O1076.jpg,O1748.jpg,2,excess alcohol and vomiting
M17.jpg,M37.jpg,2,the context is not understood.
FM992.jpg,M319.jpg,1,the context is not understood.
O1771.jpg,M37.jpg,1,babies of an orange
F840.jpg,M319.jpg,1,the cat as if he were the pope
O1717.jpg,M37.jpg,1,We lost the habit of looking at people's noses and mouths due to the pandemic when they were covered by a mask
F749.jpg,M319.jpg,1,the context is not understood.
O942.jpg,O1709.jpg,1,the animal seems to be smiling
O175.jpg,O8.jpg,2,a fruit and the resemblance to a person trying to lose weight
M969.jpg,M319.jpg,1,the context is not understood.
O1554.jpg,O1709.jpg,2,the zebra looks like it's going to fall
O356.jpg,M37.jpg,1,a child brushing his teeth
M555.jpg,M637.jpg,1,the context is not understood.
F41.jpg,O1058.jpg,1,a baby holding his grandfather in his arms
M892.jpg,M637.jpg,1,the context is not understood.
O1180.jpg,M319.jpg,1,the context is not understood.
O1299.jpg,M637.jpg,1,an eye in a candy
O1792.jpg,O8.jpg,1,breaking bad
O1137.jpg,O8.jpg,1,dog with glasses
F474.jpg,O1709.jpg,1,a basketball player in an awkward position
F587.jpg,M319.jpg,1,A man participating in a statues
M1038.jpg,O1748.jpg,2,excess alcohol and vomiting
M383.jpg,M37.jpg,1,no context
FM59.jpg,O8.jpg,2,pear as human
O1053.jpg,O1360.jpg,2,dog hide
M873.jpg,O1360.jpg,2,dog hide
M484.jpg,M319.jpg,2,no context
FM645.jpg,O1360.jpg,2,dog hide
M749.jpg,M637.jpg,1,question
M463.jpg,M637.jpg,1,no context
M1053.jpg,M319.jpg,1,no context
F947.jpg,M637.jpg,1,child
O386.jpg,O1748.jpg,2,drunk
M484.jpg,M319.jpg,1,ice
FM992.jpg,M319.jpg,2,no context
O942.jpg,O1709.jpg,1,smiling
O175.jpg,O8.jpg,2,pear as human
FM819.jpg,M319.jpg,1,no context
